{
  "coordinates": [
    "t",
    "x",
    "y",
    "z"
  ],
  "default_point": {
    "R": 1.0,
    "sigma": 8.0,
    "t": 0.0,
    "v": 2.0,
    "x": 1.0,
    "y": 0.0,
    "z": 0.0
  },
  "domain": [],
  "domain_notes": "ds^2 = -dt^2 + [dx - v f(r_s) dt]^2 + dy^2 + dz^2. A single bubble is not automatically a CTC: t is an exact temporal function on this chart (g^tt = -1), so causality violation requires an additional global or multi-bubble arrangement. Prevents equating effective superluminality with a time machine.",
  "expected_scope": "DECLARED_DOMAIN",
  "expected_status": "NO_CTC_CERTIFIED",
  "expected_status_at_default_point": "NO_CTC_CERTIFIED",
  "global_margin": false,
  "global_margin_note": "",
  "global_margin_scope": "REDUCED_MODEL",
  "identifications": [],
  "kind": "LOCAL_METRIC",
  "matter": {
    "Lambda": "0",
    "T_defined": false,
    "label": "violates the classical energy conditions",
    "note": "",
    "vacuum": false
  },
  "metadata": {
    "role": "superluminality_control"
  },
  "metric_components": {
    "00": "v**2*(-tanh(sigma*(-R + sqrt(y**2 + z**2 + (-t*v + x)**2))) + tanh(sigma*(R + sqrt(y**2 + z**2 + (-t*v + x)**2))))**2/(4*tanh(R*sigma)**2) - 1",
    "01": "-v*(-tanh(sigma*(-R + sqrt(y**2 + z**2 + (-t*v + x)**2))) + tanh(sigma*(R + sqrt(y**2 + z**2 + (-t*v + x)**2))))/(2*tanh(R*sigma))",
    "11": "1",
    "22": "1",
    "33": "1"
  },
  "metric_defined": true,
  "model_id": "alcubierre",
  "parameters": [
    "v",
    "R",
    "sigma"
  ],
  "provenance": {
    "convention_note": "",
    "derivation": "",
    "external_spec": "",
    "implementation_status": "implemented",
    "source_refs": [
      "R12"
    ]
  },
  "quotient": {
    "acts_freely": null,
    "generators": [],
    "label": "trivial",
    "note": ""
  },
  "signature": [
    1,
    0,
    3
  ],
  "signature_convention": "(-,+,+,+)",
  "temporal_function": "t",
  "theory": "GR",
  "title": "M20 Alcubierre warp metric",
  "topology": "R^4 single-bubble chart, no identifications",
  "version": "2.0"
}
