{
  "coordinates": [
    "t",
    "x",
    "y",
    "z"
  ],
  "default_point": {
    "b": 1.0,
    "t": 0.0,
    "x": 1.0,
    "y": 0.0,
    "z": 0.0
  },
  "domain": [
    {
      "expression": "t**2 + x**2",
      "name": "off_axis",
      "note": "",
      "strict": true
    }
  ],
  "domain_notes": "For the boost of rapidity b the invariant interval of the closed geodesic through p and boost^n(p) is exactly 2 (cosh(n b) - 1) (t^2 - x^2). It is negative -- a CTC -- precisely where x^2 > t^2, which is the image of the T > 0 region of the Misner chart. This reproduces M12 from a completely different representation.",
  "expected_scope": "DECLARED_DOMAIN",
  "expected_status": "CTC_PROVED",
  "expected_status_at_default_point": "CTC_PROVED",
  "global_margin": false,
  "global_margin_note": "",
  "global_margin_scope": "REDUCED_MODEL",
  "identifications": [],
  "kind": "QUOTIENT_GLOBAL",
  "matter": {
    "Lambda": "0",
    "T_defined": true,
    "label": "vacuum",
    "note": "",
    "vacuum": true
  },
  "metadata": {
    "exact_orbit_interval": "2*(cosh(n*b)-1)*(t^2-x^2)",
    "flat_covering": true,
    "role": "cross_representation_check"
  },
  "metric_components": {
    "00": "-1",
    "11": "1",
    "22": "1",
    "33": "1"
  },
  "metric_defined": true,
  "model_id": "misner_covering",
  "parameters": [
    "b"
  ],
  "provenance": {
    "convention_note": "Misner space as Minkowski modulo a boost",
    "derivation": "",
    "external_spec": "",
    "implementation_status": "implemented",
    "source_refs": [
      "R9",
      "R11"
    ]
  },
  "quotient": {
    "acts_freely": false,
    "generators": [
      {
        "image": [
          "t*cosh(b) + x*sinh(b)",
          "t*sinh(b) + x*cosh(b)",
          "y",
          "z"
        ],
        "inverse": [
          "t*cosh(b) - x*sinh(b)",
          "-t*sinh(b) + x*cosh(b)",
          "y",
          "z"
        ],
        "name": "boost",
        "note": "orthochronous boost of rapidity b in the (t,x) plane",
        "time_orientation_preserving": true
      }
    ],
    "label": "Z generated by a boost",
    "note": "the boost fixes the origin, so the quotient is taken on the complement of the fixed axis"
  },
  "signature": [
    1,
    0,
    3
  ],
  "signature_convention": "(-,+,+,+)",
  "temporal_function": null,
  "theory": "GR",
  "title": "M31 Misner space as a boost quotient of Minkowski",
  "topology": "Minkowski / <boost>; the quotient is Misner space",
  "version": "2.0"
}
