{
  "coordinates": [
    "t",
    "r",
    "phi",
    "z"
  ],
  "default_point": {
    "a": 1.0,
    "phi": 0.0,
    "r": 2.0,
    "t": 0.0,
    "z": 0.0
  },
  "domain": [
    {
      "expression": "r",
      "name": "radial",
      "note": "",
      "strict": true
    },
    {
      "expression": "a",
      "name": "rotation",
      "note": "",
      "strict": true
    }
  ],
  "domain_notes": "Azimuthal loops become timelike when r^2(1 - a^2 r^2) < 0, i.e. a r > 1. Physical matching to an exterior at some radius R is a separate constraint: the CTC region is present only if a R > 1. v1.0 stored this metric asymmetrically (defect D-02).",
  "expected_scope": "DECLARED_DOMAIN",
  "expected_status": "CTC_PROVED",
  "expected_status_at_default_point": "CTC_PROVED",
  "global_margin": false,
  "global_margin_note": "",
  "global_margin_scope": "REDUCED_MODEL",
  "identifications": [
    {
      "coordinate": "phi",
      "index": 2,
      "note": "",
      "period": "2*pi",
      "requires_killing": true
    }
  ],
  "kind": "LOCAL_METRIC",
  "matter": {
    "Lambda": "0",
    "T_defined": false,
    "label": "rigidly rotating dust",
    "note": "",
    "vacuum": false
  },
  "metadata": {
    "exact_boundary": "a r = 1",
    "role": "matter_supported_ctc"
  },
  "metric_components": {
    "00": "-1",
    "02": "a*r**2",
    "11": "exp(-a**2*r**2)",
    "22": "r**2*(-a**2*r**2 + 1)",
    "33": "exp(-a**2*r**2)"
  },
  "metric_defined": true,
  "model_id": "van_stockum",
  "parameters": [
    "a"
  ],
  "provenance": {
    "convention_note": "Bonnor form of the van Stockum interior",
    "derivation": "",
    "external_spec": "",
    "implementation_status": "implemented",
    "source_refs": [
      "R7"
    ]
  },
  "quotient": {
    "acts_freely": null,
    "generators": [],
    "label": "trivial",
    "note": ""
  },
  "signature": [
    1,
    0,
    3
  ],
  "signature_convention": "(-,+,+,+)",
  "temporal_function": null,
  "theory": "GR",
  "title": "M09 van Stockum rotating dust interior",
  "topology": "cylindrical, z noncompact, phi ~ phi + 2 pi",
  "version": "2.0"
}
