{
  "coordinates": [
    "t",
    "r",
    "phi",
    "z"
  ],
  "default_point": {
    "J": 0.1,
    "alpha": 0.8,
    "phi": 0.0,
    "r": 0.1,
    "t": 0.0,
    "z": 0.0
  },
  "domain": [
    {
      "expression": "r",
      "name": "radial",
      "note": "",
      "strict": true
    },
    {
      "expression": "alpha",
      "name": "cone_angle",
      "note": "",
      "strict": true
    },
    {
      "expression": "J",
      "name": "spin",
      "note": "",
      "strict": true
    }
  ],
  "domain_notes": "ds^2 = -(dt + 4J dphi)^2 + dr^2 + alpha^2 r^2 dphi^2 + dz^2. g_phi_phi = alpha^2 r^2 - 16 J^2 < 0 gives azimuthal CTCs inside r < 4J/alpha in the idealised model.",
  "expected_scope": "DECLARED_DOMAIN",
  "expected_status": "CTC_PROVED",
  "expected_status_at_default_point": "CTC_PROVED",
  "global_margin": false,
  "global_margin_note": "",
  "global_margin_scope": "REDUCED_MODEL",
  "identifications": [
    {
      "coordinate": "phi",
      "index": 2,
      "note": "",
      "period": "2*pi",
      "requires_killing": true
    }
  ],
  "kind": "QUOTIENT_GLOBAL",
  "matter": {
    "Lambda": "0",
    "T_defined": false,
    "label": "distributional string source on the axis",
    "note": "",
    "vacuum": false
  },
  "metadata": {
    "exact_boundary": "alpha^2 r^2 = 16 J^2",
    "role": "conical_quotient_benchmark"
  },
  "metric_components": {
    "00": "-1",
    "02": "-4*J",
    "11": "1",
    "22": "-16*J**2 + alpha**2*r**2",
    "33": "1"
  },
  "metric_defined": true,
  "model_id": "spinning_cosmic_string",
  "parameters": [
    "J",
    "alpha"
  ],
  "provenance": {
    "convention_note": "",
    "derivation": "",
    "external_spec": "",
    "implementation_status": "implemented",
    "source_refs": [
      "R8",
      "R26"
    ]
  },
  "quotient": {
    "acts_freely": null,
    "generators": [],
    "label": "trivial",
    "note": ""
  },
  "signature": [
    1,
    0,
    3
  ],
  "signature_convention": "(-,+,+,+)",
  "temporal_function": null,
  "theory": "GR with a distributional source",
  "title": "M13 Spinning cosmic string",
  "topology": "conical quotient; phi ~ phi + 2 pi; deficit angle 2 pi (1 - alpha)",
  "version": "2.0"
}
