{
  "coordinates": [
    "t",
    "r",
    "theta",
    "phi"
  ],
  "default_point": {
    "L": 1.0,
    "phi": 0.0,
    "r": 1.0,
    "t": 0.0,
    "theta": 1.5707963267948966
  },
  "domain": [
    {
      "expression": "r",
      "name": "radial",
      "note": "",
      "strict": false
    },
    {
      "expression": "sin(theta)",
      "name": "polar_regular",
      "note": "",
      "strict": true
    }
  ],
  "domain_notes": "IDENTICAL local metric to ads4_universal_cover. The orbit of the Killing vector d/dt is closed and timelike everywhere (g_tt = -(1 + r^2/L^2) < 0), so every point lies on a CTC. The two models differ ONLY in the deck group, which is exactly the L3 scientific gate: local equality of metrics does not imply equality of global causal structure.",
  "expected_scope": "GLOBAL",
  "expected_status": "CTC_PROVED",
  "expected_status_at_default_point": "CTC_PROVED",
  "global_margin": false,
  "global_margin_note": "",
  "global_margin_scope": "REDUCED_MODEL",
  "identifications": [
    {
      "coordinate": "t",
      "index": 0,
      "note": "",
      "period": "2*pi*L",
      "requires_killing": true
    },
    {
      "coordinate": "phi",
      "index": 3,
      "note": "",
      "period": "2*pi",
      "requires_killing": true
    }
  ],
  "kind": "QUOTIENT_GLOBAL",
  "matter": {
    "Lambda": "-3/L**2",
    "T_defined": false,
    "label": "vacuum with a negative cosmological constant",
    "note": "",
    "vacuum": true
  },
  "metadata": {
    "pair": "ads4_universal_cover",
    "role": "L3_gate_pair"
  },
  "metric_components": {
    "00": "-1 - r**2/L**2",
    "11": "1/(1 + r**2/L**2)",
    "22": "r**2",
    "33": "r**2*sin(theta)**2"
  },
  "metric_defined": true,
  "model_id": "ads4_periodic",
  "parameters": [
    "L"
  ],
  "provenance": {
    "convention_note": "AdS as a quadric in R^{2,3} has closed timelike curves; the universal cover removes them",
    "derivation": "",
    "external_spec": "",
    "implementation_status": "implemented",
    "source_refs": [
      "R26",
      "R27"
    ]
  },
  "quotient": {
    "acts_freely": true,
    "generators": [
      {
        "image": [
          "2*pi*L + t",
          "r",
          "theta",
          "phi"
        ],
        "inverse": [
          "-2*pi*L + t",
          "r",
          "theta",
          "phi"
        ],
        "name": "time_shift",
        "note": "the closed timelike Killing orbit of the AdS quadric",
        "time_orientation_preserving": true
      }
    ],
    "label": "Z generated by t -> t + 2 pi L",
    "note": ""
  },
  "signature": [
    1,
    0,
    3
  ],
  "signature_convention": "(-,+,+,+)",
  "temporal_function": null,
  "theory": "GR with Lambda = -3/L^2",
  "title": "M24 AdS4 hyperboloid, periodic time (t ~ t + 2 pi L)",
  "topology": "S^1 (time) x R^3; the embedded quadric in R^{2,3}",
  "version": "2.0"
}
