{
  "coordinates": [
    "T",
    "x",
    "y",
    "z"
  ],
  "default_point": {
    "L": 1.0,
    "T": 1.0,
    "x": 0.0,
    "y": 0.0,
    "z": 0.0
  },
  "domain": [],
  "domain_notes": "ds^2 = dx^2 + dy^2 - 2 dT dz + [F(x,y) - T] dz^2 with the harmonic benchmark F = x^2 - y^2 (Laplacian zero, so the core is vacuum). At fixed (x,y) the compact z direction changes from spacelike to timelike when F - T crosses zero. This is the decisive counterexample to any universal rule 'CTC implies NEC violation'.",
  "expected_scope": "DECLARED_DOMAIN",
  "expected_status": "CTC_PROVED",
  "expected_status_at_default_point": "CTC_PROVED",
  "global_margin": false,
  "global_margin_note": "",
  "global_margin_scope": "REDUCED_MODEL",
  "identifications": [
    {
      "coordinate": "z",
      "index": 3,
      "note": "",
      "period": "L",
      "requires_killing": true
    }
  ],
  "kind": "QUOTIENT_GLOBAL",
  "matter": {
    "Lambda": "0",
    "T_defined": true,
    "label": "vacuum core; surrounding matter in the full Ori model satisfies WEC, DEC and SEC",
    "note": "",
    "vacuum": true
  },
  "metadata": {
    "exact_boundary": "T = F(x,y)",
    "role": "energy_condition_counterexample"
  },
  "metric_components": {
    "03": "-1",
    "11": "1",
    "22": "1",
    "33": "-T + x**2 - y**2"
  },
  "metric_defined": true,
  "model_id": "ori_2005",
  "parameters": [
    "L"
  ],
  "provenance": {
    "convention_note": "",
    "derivation": "",
    "external_spec": "",
    "implementation_status": "implemented",
    "source_refs": [
      "R14"
    ]
  },
  "quotient": {
    "acts_freely": null,
    "generators": [],
    "label": "trivial",
    "note": ""
  },
  "signature": [
    1,
    0,
    3
  ],
  "signature_convention": "(-,+,+,+)",
  "temporal_function": null,
  "theory": "GR",
  "title": "M17 Ori 2005 compact vacuum-core chart",
  "topology": "z periodically identified with period L",
  "version": "2.0"
}
