{
  "coordinates": [
    "t",
    "x",
    "y",
    "z"
  ],
  "default_point": {
    "P": 1.0,
    "t": 0.0,
    "x": 0.0,
    "y": 0.0,
    "z": 0.0
  },
  "domain": [],
  "domain_notes": "Local metric identical to Minkowski, which is the strongest no-CTC control in the registry. The only difference is the deck group. Any architecture that classifies these two the same has failed the L3 gate.",
  "expected_scope": "GLOBAL",
  "expected_status": "CTC_PROVED",
  "expected_status_at_default_point": "CTC_PROVED",
  "global_margin": false,
  "global_margin_note": "",
  "global_margin_scope": "REDUCED_MODEL",
  "identifications": [
    {
      "coordinate": "t",
      "index": 0,
      "note": "",
      "period": "P",
      "requires_killing": true
    }
  ],
  "kind": "QUOTIENT_GLOBAL",
  "matter": {
    "Lambda": "0",
    "T_defined": true,
    "label": "vacuum",
    "note": "",
    "vacuum": true
  },
  "metadata": {
    "flat_covering": true,
    "pair": "minkowski",
    "role": "L3_gate_pair"
  },
  "metric_components": {
    "00": "-1",
    "11": "1",
    "22": "1",
    "33": "1"
  },
  "metric_defined": true,
  "model_id": "minkowski_time_periodic",
  "parameters": [
    "P"
  ],
  "provenance": {
    "convention_note": "",
    "derivation": "",
    "external_spec": "",
    "implementation_status": "implemented",
    "source_refs": [
      "R26",
      "R27"
    ]
  },
  "quotient": {
    "acts_freely": true,
    "generators": [
      {
        "image": [
          "P + t",
          "x",
          "y",
          "z"
        ],
        "inverse": [
          "-P + t",
          "x",
          "y",
          "z"
        ],
        "name": "time_shift",
        "note": "",
        "time_orientation_preserving": true
      }
    ],
    "label": "Z generated by t -> t + P",
    "note": ""
  },
  "signature": [
    1,
    0,
    3
  ],
  "signature_convention": "(-,+,+,+)",
  "temporal_function": null,
  "theory": "GR",
  "title": "M30 Minkowski with periodic time (t ~ t + P)",
  "topology": "S^1 x R^3",
  "version": "2.0"
}
