{
  "coordinates": [
    "t",
    "x",
    "y",
    "z"
  ],
  "default_point": {
    "alpha": 1.0,
    "b": 1.0,
    "t": 0.0,
    "x": 3.0,
    "y": 0.0,
    "z": 0.0
  },
  "domain": [],
  "domain_notes": "The invariant interval of the closed geodesic through p and g^n(p) is exactly 2 (cosh(n b) - 1)(t^2 - x^2) + n^2 alpha^2. The winding-n loop is null on the POLARISED HYPERSURFACE x^2 - t^2 = n^2 alpha^2 / (2 (cosh(n b) - 1)) and timelike outside it. Because that radius decreases monotonically to zero as n grows, the union over all n is the whole region x^2 > t^2: alpha > 0 does NOT move the chronology horizon, which stays at x^2 = t^2 exactly as in Misner space. What alpha creates is the discrete family of polarised hypersurfaces that accumulates on the horizon, and those are where the renormalised stress tensor of a quantum field is singular. CTC-FA v2.0 locates them automatically from the deck group; see quotient_ctc.polarized_hypersurfaces.",
  "expected_scope": "DECLARED_DOMAIN",
  "expected_status": "CTC_PROVED",
  "expected_status_at_default_point": "CTC_PROVED",
  "global_margin": false,
  "global_margin_note": "",
  "global_margin_scope": "REDUCED_MODEL",
  "identifications": [],
  "kind": "QUOTIENT_GLOBAL",
  "matter": {
    "Lambda": "0",
    "T_defined": true,
    "label": "vacuum",
    "note": "",
    "vacuum": true
  },
  "metadata": {
    "chronology_horizon": "x^2 = t^2",
    "exact_orbit_interval": "2*(cosh(n*b)-1)*(t^2-x^2) + n^2*alpha^2",
    "flat_covering": true,
    "polarized_hypersurface_n": "x^2 - t^2 = n^2*alpha^2/(2*(cosh(n*b)-1))",
    "role": "polarised_quotient_benchmark"
  },
  "metric_components": {
    "00": "-1",
    "11": "1",
    "22": "1",
    "33": "1"
  },
  "metric_defined": true,
  "model_id": "grant_space",
  "parameters": [
    "b",
    "alpha"
  ],
  "provenance": {
    "convention_note": "Grant 1993; Rieger 2026 causal classification",
    "derivation": "",
    "external_spec": "",
    "implementation_status": "implemented",
    "source_refs": [
      "R9",
      "R11",
      "R17"
    ]
  },
  "quotient": {
    "acts_freely": true,
    "generators": [
      {
        "image": [
          "t*cosh(b) + x*sinh(b)",
          "t*sinh(b) + x*cosh(b)",
          "alpha + y",
          "z"
        ],
        "inverse": [
          "t*cosh(b) - x*sinh(b)",
          "-t*sinh(b) + x*cosh(b)",
          "-alpha + y",
          "z"
        ],
        "name": "boost_translate",
        "note": "boost of rapidity b in (t,x) composed with a translation alpha in y",
        "time_orientation_preserving": true
      }
    ],
    "label": "Z generated by a screw isometry",
    "note": "the added translation removes the fixed axis, so the action is free and the quotient is a manifold"
  },
  "signature": [
    1,
    0,
    3
  ],
  "signature_convention": "(-,+,+,+)",
  "temporal_function": null,
  "theory": "GR",
  "title": "M27 Grant space (boost + translation quotient)",
  "topology": "Minkowski / <boost x translation>",
  "version": "2.0"
}
