{
  "coordinates": [
    "t",
    "r",
    "phi"
  ],
  "default_point": {
    "J_BTZ": 0.5,
    "M_BTZ": 1.0,
    "ell": 1.0,
    "phi": 0.0,
    "r": 3.0,
    "t": 0.0
  },
  "domain": [
    {
      "expression": "r",
      "name": "radial",
      "note": "",
      "strict": true
    },
    {
      "expression": "J_BTZ**2/(4*r**2) - M_BTZ + r**2/ell**2",
      "name": "outside_outer_horizon",
      "note": "",
      "strict": true
    },
    {
      "expression": "-J_BTZ**2 + M_BTZ**2*ell**2",
      "name": "subextremal",
      "note": "",
      "strict": true
    }
  ],
  "domain_notes": "On the standard chart g_phi_phi = r^2 > 0, so the azimuthal sector is spacelike everywhere. The chronology-violating region of the maximally extended BTZ geometry sits at r^2 < 0 and is EXCISED BY DEFINITION of the spacetime -- exactly as the Kerr CTC region is retained by definition. Registered as a control for the claim 'a quotient of AdS is automatically causality violating', which is false.",
  "expected_scope": "DECLARED_DOMAIN",
  "expected_status": "NO_CTC_CERTIFIED",
  "expected_status_at_default_point": "NO_CTC_CERTIFIED",
  "global_margin": false,
  "global_margin_note": "",
  "global_margin_scope": "REDUCED_MODEL",
  "identifications": [
    {
      "coordinate": "phi",
      "index": 2,
      "note": "",
      "period": "2*pi",
      "requires_killing": true
    }
  ],
  "kind": "QUOTIENT_GLOBAL",
  "matter": {
    "Lambda": "-1/ell**2",
    "T_defined": false,
    "label": "vacuum with a negative cosmological constant",
    "note": "",
    "vacuum": true
  },
  "metadata": {
    "excised_region": "r^2 < 0",
    "role": "excision_control"
  },
  "metric_components": {
    "00": "M_BTZ - r**2/ell**2",
    "02": "-J_BTZ/2",
    "11": "4*ell**2*r**2/(J_BTZ**2*ell**2 - 4*M_BTZ*ell**2*r**2 + 4*r**4)",
    "22": "r**2"
  },
  "metric_defined": true,
  "model_id": "btz_rotating",
  "parameters": [
    "M_BTZ",
    "J_BTZ",
    "ell"
  ],
  "provenance": {
    "convention_note": "Banados-Teitelboim-Zanelli black hole; standard exterior chart",
    "derivation": "",
    "external_spec": "",
    "implementation_status": "implemented",
    "source_refs": [
      "R26",
      "R27"
    ]
  },
  "quotient": {
    "acts_freely": null,
    "generators": [],
    "label": "trivial",
    "note": ""
  },
  "signature": [
    1,
    0,
    2
  ],
  "signature_convention": "(-,+,+,+)",
  "temporal_function": null,
  "theory": "GR in 2+1 with Lambda = -1/ell^2",
  "title": "M29 Rotating BTZ black hole (2+1)",
  "topology": "quotient of AdS3 by a discrete boost; phi ~ phi + 2 pi",
  "version": "2.0"
}
