{
  "coordinates": [
    "t",
    "r",
    "theta",
    "phi"
  ],
  "default_point": {
    "M": 1.0,
    "Q": 0.5,
    "phi": 0.0,
    "r": 5.0,
    "t": 0.0,
    "theta": 1.5707963267948966
  },
  "domain": [
    {
      "expression": "-M + r - sqrt(M**2 - Q**2)",
      "name": "outside_outer_horizon",
      "note": "",
      "strict": true
    },
    {
      "expression": "M**2 - Q**2",
      "name": "subextremal",
      "note": "",
      "strict": true
    },
    {
      "expression": "sin(theta)",
      "name": "polar_regular",
      "note": "",
      "strict": true
    }
  ],
  "domain_notes": "Critical negative control against the logical error 'Cauchy horizon implies CTC'. r_pm = M +- sqrt(M^2 - Q^2).",
  "expected_scope": "DECLARED_DOMAIN",
  "expected_status": "NO_CTC_CERTIFIED",
  "expected_status_at_default_point": "NO_CTC_CERTIFIED",
  "global_margin": false,
  "global_margin_note": "",
  "global_margin_scope": "REDUCED_MODEL",
  "identifications": [
    {
      "coordinate": "phi",
      "index": 3,
      "note": "",
      "period": "2*pi",
      "requires_killing": true
    }
  ],
  "kind": "LOCAL_METRIC",
  "matter": {
    "Lambda": "0",
    "T_defined": false,
    "label": "electrovacuum",
    "note": "",
    "vacuum": false
  },
  "metadata": {
    "cauchy_horizon": "r_- = M - sqrt(M^2 - Q^2)",
    "role": "negative_control"
  },
  "metric_components": {
    "00": "2*M/r - Q**2/r**2 - 1",
    "11": "1/(-2*M/r + Q**2/r**2 + 1)",
    "22": "r**2",
    "33": "r**2*sin(theta)**2"
  },
  "metric_defined": true,
  "model_id": "reissner_nordstrom",
  "parameters": [
    "M",
    "Q"
  ],
  "provenance": {
    "convention_note": "",
    "derivation": "",
    "external_spec": "",
    "implementation_status": "implemented",
    "source_refs": [
      "R26",
      "R28"
    ]
  },
  "quotient": {
    "acts_freely": null,
    "generators": [],
    "label": "trivial",
    "note": ""
  },
  "signature": [
    1,
    0,
    3
  ],
  "signature_convention": "(-,+,+,+)",
  "temporal_function": "t",
  "theory": "Einstein-Maxwell",
  "title": "M04 Reissner-Nordstrom",
  "topology": "phi ~ phi + 2 pi",
  "version": "2.0"
}
