{
  "coordinates": [
    "t",
    "r",
    "theta",
    "phi"
  ],
  "default_point": {
    "L": 1.0,
    "phi": 0.0,
    "r": 1.0,
    "t": 0.0,
    "theta": 1.5707963267948966
  },
  "domain": [
    {
      "expression": "r",
      "name": "radial",
      "note": "",
      "strict": false
    },
    {
      "expression": "sin(theta)",
      "name": "polar_regular",
      "note": "",
      "strict": true
    }
  ],
  "domain_notes": "g^tt = -1/(1 + r^2/L^2) < 0 everywhere, so t is an exact global temporal function and the spacetime is stably causal. This is the CHRONAL member of the AdS pair.",
  "expected_scope": "GLOBAL",
  "expected_status": "NO_CTC_CERTIFIED",
  "expected_status_at_default_point": "NO_CTC_CERTIFIED",
  "global_margin": false,
  "global_margin_note": "",
  "global_margin_scope": "REDUCED_MODEL",
  "identifications": [
    {
      "coordinate": "phi",
      "index": 3,
      "note": "",
      "period": "2*pi",
      "requires_killing": true
    }
  ],
  "kind": "LOCAL_METRIC",
  "matter": {
    "Lambda": "-3/L**2",
    "T_defined": false,
    "label": "vacuum with a negative cosmological constant",
    "note": "",
    "vacuum": true
  },
  "metadata": {
    "pair": "ads4_periodic",
    "role": "L3_gate_pair"
  },
  "metric_components": {
    "00": "-1 - r**2/L**2",
    "11": "1/(1 + r**2/L**2)",
    "22": "r**2",
    "33": "r**2*sin(theta)**2"
  },
  "metric_defined": true,
  "model_id": "ads4_universal_cover",
  "parameters": [
    "L"
  ],
  "provenance": {
    "convention_note": "global AdS4 chart; the universal cover unwraps the periodic time of the embedded hyperboloid",
    "derivation": "",
    "external_spec": "",
    "implementation_status": "implemented",
    "source_refs": [
      "R26",
      "R27"
    ]
  },
  "quotient": {
    "acts_freely": null,
    "generators": [],
    "label": "trivial",
    "note": ""
  },
  "signature": [
    1,
    0,
    3
  ],
  "signature_convention": "(-,+,+,+)",
  "temporal_function": "t",
  "theory": "GR with Lambda = -3/L^2",
  "title": "M23 AdS4, universal cover (t in R)",
  "topology": "R (time) x R^3; simply connected in the time direction",
  "version": "2.0"
}
